{
    "order_id": "O-300",
    "reason": "customer_request",
    "items": [
        { "type": "physical", "gross_amount": "-100.00", "vat_amount": "-20.00", "vat_rate": "0.25" }
    ],
    "refund_payments": [
        { "gateway": "stripe", "original_transaction_id": "pi_orig", "refund_transaction_id": "re_new", "amount": "100.00" }
    ],
    "credit_note_number": "CN-2026-0001"
}
